{"schema_version":2,"estado":"23","anio_eleccion":2024,"grano":"grupo_edad","fuentes":["INE"],"referencias":{"censo":2020,"cartografia":2023,"referencia_retroactiva":false},"medidas":[{"AELEC":2024,"EDOCVE":23,"grupo_edad":"45-59","publicacion":"available","ln":337252,"sv":208793,"nv":117879,"ns":10580,"participacion_pct":63.91518097663712},{"AELEC":2024,"EDOCVE":23,"grupo_edad":"25-34","publicacion":"available","ln":396247,"sv":172690,"nv":211106,"ns":12451,"participacion_pct":44.99525789742467},{"AELEC":2024,"EDOCVE":23,"grupo_edad":"18-24","publicacion":"available","ln":221836,"sv":101346,"nv":113150,"ns":7340,"participacion_pct":47.24843353722214},{"AELEC":2024,"EDOCVE":23,"grupo_edad":"60+","publicacion":"available","ln":166839,"sv":114410,"nv":47104,"ns":5325,"participacion_pct":70.83596468417599},{"AELEC":2024,"EDOCVE":23,"grupo_edad":"35-44","publicacion":"available","ln":337897,"sv":176701,"nv":150959,"ns":10237,"participacion_pct":53.928157236159436}]}