{"schema_version":2,"estado":"11","anio_eleccion":2015,"grano":"entidad","fuentes":["INE"],"referencias":{"censo":2010,"cartografia":2021,"referencia_retroactiva":true},"medidas":[{"AELEC":2015,"EDOCVE":11,"publicacion":"available","ln":4093632,"sv":1698101,"nv":2067579,"ns":327952,"participacion_pct":45.09413970385163}]}