{"schema_version":2,"estado":"01","anio_eleccion":2015,"grano":"municipio","fuentes":["INE"],"referencias":{"censo":2010,"cartografia":2021,"referencia_retroactiva":true},"medidas":[{"AELEC":2015,"EDOCVE":1,"MPIOCVE":1,"publicacion":"available","ln":589488,"sv":197425,"nv":355774,"ns":36289,"participacion_pct":35.68788085300226},{"AELEC":2015,"EDOCVE":1,"MPIOCVE":2,"publicacion":"available","ln":31344,"sv":14819,"nv":16525,"ns":0,"participacion_pct":47.278586013272076},{"AELEC":2015,"EDOCVE":1,"MPIOCVE":3,"publicacion":"available","ln":42938,"sv":15240,"nv":27698,"ns":0,"participacion_pct":35.49303647119102},{"AELEC":2015,"EDOCVE":1,"MPIOCVE":4,"publicacion":"available","ln":10625,"sv":4239,"nv":6386,"ns":0,"participacion_pct":39.896470588235296},{"AELEC":2015,"EDOCVE":1,"MPIOCVE":5,"publicacion":"available","ln":68971,"sv":23819,"nv":45152,"ns":0,"participacion_pct":34.5348044830436},{"AELEC":2015,"EDOCVE":1,"MPIOCVE":6,"publicacion":"available","ln":28523,"sv":10814,"nv":17709,"ns":0,"participacion_pct":37.91326298075238},{"AELEC":2015,"EDOCVE":1,"MPIOCVE":7,"publicacion":"available","ln":34501,"sv":11314,"nv":23187,"ns":0,"participacion_pct":32.793252369496535},{"AELEC":2015,"EDOCVE":1,"MPIOCVE":8,"publicacion":"available","ln":6358,"sv":3066,"nv":3292,"ns":0,"participacion_pct":48.22271154451085},{"AELEC":2015,"EDOCVE":1,"MPIOCVE":9,"publicacion":"available","ln":14122,"sv":7261,"nv":6861,"ns":0,"participacion_pct":51.41622999575131},{"AELEC":2015,"EDOCVE":1,"MPIOCVE":10,"publicacion":"available","ln":26767,"sv":8598,"nv":18169,"ns":0,"participacion_pct":32.12164232076811},{"AELEC":2015,"EDOCVE":1,"MPIOCVE":11,"publicacion":"available","ln":13719,"sv":6019,"nv":7700,"ns":0,"participacion_pct":43.873460164735036}]}