{"schema_version":2,"estado":"16","anio_eleccion":2009,"grano":"grupo_edad","fuentes":["INE"],"referencias":{"censo":2010,"cartografia":2021,"referencia_retroactiva":true},"medidas":[{"AELEC":2009,"EDOCVE":16,"grupo_edad":"45-59","publicacion":"available","ln":656008,"sv":262924,"nv":370289,"ns":22795,"participacion_pct":41.52220500842529},{"AELEC":2009,"EDOCVE":16,"grupo_edad":"18-24","publicacion":"available","ln":479981,"sv":125840,"nv":338369,"ns":15772,"participacion_pct":27.108479154863435},{"AELEC":2009,"EDOCVE":16,"grupo_edad":"25-34","publicacion":"available","ln":841374,"sv":193221,"nv":620344,"ns":27809,"participacion_pct":23.749915495381437},{"AELEC":2009,"EDOCVE":16,"grupo_edad":"no_especificada","publicacion":"suppressed","ln":null,"sv":null,"nv":null,"ns":null,"participacion_pct":null},{"AELEC":2009,"EDOCVE":16,"grupo_edad":"60+","publicacion":"available","ln":533098,"sv":218485,"nv":294825,"ns":19788,"participacion_pct":42.56394771190898},{"AELEC":2009,"EDOCVE":16,"grupo_edad":"35-44","publicacion":"available","ln":697987,"sv":211800,"nv":462744,"ns":23443,"participacion_pct":31.398989539600084}]}