{"schema_version":2,"estado":"02","anio_eleccion":2012,"grano":"sexo","fuentes":["INE"],"referencias":{"censo":2010,"cartografia":2021,"referencia_retroactiva":true},"medidas":[{"AELEC":2012,"EDOCVE":2,"SEXO":0,"publicacion":"available","ln":1138743,"sv":554157,"nv":583231,"ns":1355,"participacion_pct":48.721896133949016},{"AELEC":2012,"EDOCVE":2,"SEXO":1,"publicacion":"available","ln":1130769,"sv":630421,"nv":498957,"ns":1391,"participacion_pct":55.82019483290802}]}