{"schema_version":2,"estado":"27","anio_eleccion":2024,"grano":"municipio","fuentes":["INE","INEGI","CONAPO"],"contexto_municipal":[{"AELEC":2024,"EDOCVE":27,"MPIOCVE":1,"LN":43671,"SV":25454,"NV":14628,"NS":3589,"participacion_pct":63.50481512898558,"publication_status":"available","anio":2024,"edo":27,"cvegeo_municipal_inegi":"270010000","inegi_pobtot":58524,"censo_ref":2020,"inegi_matched":true,"poblacion_conapo":58932.0,"conapo_ref":2024,"conapo_matched":true,"granularidad_contexto":"municipio","anio_cartografia_referencia":2023,"referencia_retroactiva":false},{"AELEC":2024,"EDOCVE":27,"MPIOCVE":10,"LN":69371,"SV":42776,"NV":20848,"NS":5747,"participacion_pct":67.23249088394317,"publication_status":"available","anio":2024,"edo":27,"cvegeo_municipal_inegi":"270100000","inegi_pobtot":91185,"censo_ref":2020,"inegi_matched":true,"poblacion_conapo":93811.0,"conapo_ref":2024,"conapo_matched":true,"granularidad_contexto":"municipio","anio_cartografia_referencia":2023,"referencia_retroactiva":false},{"AELEC":2024,"EDOCVE":27,"MPIOCVE":12,"LN":121581,"SV":56854,"NV":56625,"NS":8102,"participacion_pct":50.10089972594048,"publication_status":"available","anio":2024,"edo":27,"cvegeo_municipal_inegi":"270120000","inegi_pobtot":158601,"censo_ref":2020,"inegi_matched":true,"poblacion_conapo":159994.0,"conapo_ref":2024,"conapo_matched":true,"granularidad_contexto":"municipio","anio_cartografia_referencia":2023,"referencia_retroactiva":false},{"AELEC":2024,"EDOCVE":27,"MPIOCVE":17,"LN":46648,"SV":26795,"NV":18119,"NS":1734,"participacion_pct":59.658458387139866,"publication_status":"available","anio":2024,"edo":27,"cvegeo_municipal_inegi":"270170000","inegi_pobtot":62310,"censo_ref":2020,"inegi_matched":true,"poblacion_conapo":65963.0,"conapo_ref":2024,"conapo_matched":true,"granularidad_contexto":"municipio","anio_cartografia_referencia":2023,"referencia_retroactiva":false},{"AELEC":2024,"EDOCVE":27,"MPIOCVE":4,"LN":529215,"SV":284825,"NV":210533,"NS":33857,"participacion_pct":57.49881903592957,"publication_status":"available","anio":2024,"edo":27,"cvegeo_municipal_inegi":"270040000","inegi_pobtot":683607,"censo_ref":2020,"inegi_matched":true,"poblacion_conapo":697711.0,"conapo_ref":2024,"conapo_matched":true,"granularidad_contexto":"municipio","anio_cartografia_referencia":2023,"referencia_retroactiva":false},{"AELEC":2024,"EDOCVE":27,"MPIOCVE":13,"LN":107528,"SV":62728,"NV":40202,"NS":4598,"participacion_pct":60.94238803070048,"publication_status":"available","anio":2024,"edo":27,"cvegeo_municipal_inegi":"270130000","inegi_pobtot":150300,"censo_ref":2020,"inegi_matched":true,"poblacion_conapo":160443.0,"conapo_ref":2024,"conapo_matched":true,"granularidad_contexto":"municipio","anio_cartografia_referencia":2023,"referencia_retroactiva":false},{"AELEC":2024,"EDOCVE":27,"MPIOCVE":5,"LN":163591,"SV":102251,"NV":52803,"NS":8537,"participacion_pct":65.94541256594476,"publication_status":"available","anio":2024,"edo":27,"cvegeo_municipal_inegi":"270050000","inegi_pobtot":214877,"censo_ref":2020,"inegi_matched":true,"poblacion_conapo":223853.0,"conapo_ref":2024,"conapo_matched":true,"granularidad_contexto":"municipio","anio_cartografia_referencia":2023,"referencia_retroactiva":false},{"AELEC":2024,"EDOCVE":27,"MPIOCVE":16,"LN":42416,"SV":21509,"NV":16799,"NS":4108,"participacion_pct":56.14754098360656,"publication_status":"available","anio":2024,"edo":27,"cvegeo_municipal_inegi":"270160000","inegi_pobtot":58718,"censo_ref":2020,"inegi_matched":true,"poblacion_conapo":60009.0,"conapo_ref":2024,"conapo_matched":true,"granularidad_contexto":"municipio","anio_cartografia_referencia":2023,"referencia_retroactiva":false},{"AELEC":2024,"EDOCVE":27,"MPIOCVE":3,"LN":79935,"SV":45613,"NV":27712,"NS":6610,"participacion_pct":62.206614387998634,"publication_status":"available","anio":2024,"edo":27,"cvegeo_municipal_inegi":"270030000","inegi_pobtot":107731,"censo_ref":2020,"inegi_matched":true,"poblacion_conapo":108053.0,"conapo_ref":2024,"conapo_matched":true,"granularidad_contexto":"municipio","anio_cartografia_referencia":2023,"referencia_retroactiva":false},{"AELEC":2024,"EDOCVE":27,"MPIOCVE":14,"LN":74833,"SV":43697,"NV":21961,"NS":9175,"participacion_pct":66.55243839288434,"publication_status":"available","anio":2024,"edo":27,"cvegeo_municipal_inegi":"270140000","inegi_pobtot":96741,"censo_ref":2020,"inegi_matched":true,"poblacion_conapo":99726.0,"conapo_ref":2024,"conapo_matched":true,"granularidad_contexto":"municipio","anio_cartografia_referencia":2023,"referencia_retroactiva":false},{"AELEC":2024,"EDOCVE":27,"MPIOCVE":15,"LN":35490,"SV":22114,"NV":12201,"NS":1175,"participacion_pct":64.4441206469474,"publication_status":"available","anio":2024,"edo":27,"cvegeo_municipal_inegi":"270150000","inegi_pobtot":47905,"censo_ref":2020,"inegi_matched":true,"poblacion_conapo":48390.0,"conapo_ref":2024,"conapo_matched":true,"granularidad_contexto":"municipio","anio_cartografia_referencia":2023,"referencia_retroactiva":false},{"AELEC":2024,"EDOCVE":27,"MPIOCVE":8,"LN":137159,"SV":68323,"NV":48923,"NS":19913,"participacion_pct":58.2732033502209,"publication_status":"available","anio":2024,"edo":27,"cvegeo_municipal_inegi":"270080000","inegi_pobtot":190885,"censo_ref":2020,"inegi_matched":true,"poblacion_conapo":196988.0,"conapo_ref":2024,"conapo_matched":true,"granularidad_contexto":"municipio","anio_cartografia_referencia":2023,"referencia_retroactiva":false},{"AELEC":2024,"EDOCVE":27,"MPIOCVE":9,"LN":29026,"SV":16689,"NV":7934,"NS":4403,"participacion_pct":67.77809365227633,"publication_status":"available","anio":2024,"edo":27,"cvegeo_municipal_inegi":"270090000","inegi_pobtot":37749,"censo_ref":2020,"inegi_matched":true,"poblacion_conapo":38164.0,"conapo_ref":2024,"conapo_matched":true,"granularidad_contexto":"municipio","anio_cartografia_referencia":2023,"referencia_retroactiva":false},{"AELEC":2024,"EDOCVE":27,"MPIOCVE":6,"LN":99870,"SV":57191,"NV":36127,"NS":6552,"participacion_pct":61.2861398658351,"publication_status":"available","anio":2024,"edo":27,"cvegeo_municipal_inegi":"270060000","inegi_pobtot":137257,"censo_ref":2020,"inegi_matched":true,"poblacion_conapo":139217.0,"conapo_ref":2024,"conapo_matched":true,"granularidad_contexto":"municipio","anio_cartografia_referencia":2023,"referencia_retroactiva":false},{"AELEC":2024,"EDOCVE":27,"MPIOCVE":2,"LN":182041,"SV":86393,"NV":70510,"NS":25138,"participacion_pct":55.06140736633461,"publication_status":"available","anio":2024,"edo":27,"cvegeo_municipal_inegi":"270020000","inegi_pobtot":243229,"censo_ref":2020,"inegi_matched":true,"poblacion_conapo":245409.0,"conapo_ref":2024,"conapo_matched":true,"granularidad_contexto":"municipio","anio_cartografia_referencia":2023,"referencia_retroactiva":false},{"AELEC":2024,"EDOCVE":27,"MPIOCVE":11,"LN":24515,"SV":18030,"NV":4760,"NS":1725,"participacion_pct":79.11364633611232,"publication_status":"available","anio":2024,"edo":27,"cvegeo_municipal_inegi":"270110000","inegi_pobtot":30798,"censo_ref":2020,"inegi_matched":true,"poblacion_conapo":31686.0,"conapo_ref":2024,"conapo_matched":true,"granularidad_contexto":"municipio","anio_cartografia_referencia":2023,"referencia_retroactiva":false},{"AELEC":2024,"EDOCVE":27,"MPIOCVE":7,"LN":24620,"SV":15153,"NV":6674,"NS":2793,"participacion_pct":69.4231914601182,"publication_status":"available","anio":2024,"edo":27,"cvegeo_municipal_inegi":"270070000","inegi_pobtot":32181,"censo_ref":2020,"inegi_matched":true,"poblacion_conapo":33206.0,"conapo_ref":2024,"conapo_matched":true,"granularidad_contexto":"municipio","anio_cartografia_referencia":2023,"referencia_retroactiva":false}]}