{"schema_version":2,"estado":"19","anio_eleccion":2024,"grano":"municipio","fuentes":["INE"],"referencias":{"censo":2020,"cartografia":2023,"referencia_retroactiva":false},"medidas":[{"AELEC":2024,"EDOCVE":19,"MPIOCVE":1,"publicacion":"available","ln":2596,"sv":1469,"nv":385,"ns":742,"participacion_pct":79.23408845738943},{"AELEC":2024,"EDOCVE":19,"MPIOCVE":2,"publicacion":"available","ln":4583,"sv":3284,"nv":1299,"ns":0,"participacion_pct":71.65612044512328},{"AELEC":2024,"EDOCVE":19,"MPIOCVE":3,"publicacion":"available","ln":2195,"sv":1387,"nv":808,"ns":0,"participacion_pct":63.18906605922551},{"AELEC":2024,"EDOCVE":19,"MPIOCVE":4,"publicacion":"available","ln":31211,"sv":14680,"nv":13427,"ns":3104,"participacion_pct":52.22898210410218},{"AELEC":2024,"EDOCVE":19,"MPIOCVE":5,"publicacion":"available","ln":14690,"sv":9110,"nv":4550,"ns":1030,"participacion_pct":66.69106881405564},{"AELEC":2024,"EDOCVE":19,"MPIOCVE":6,"publicacion":"available","ln":484179,"sv":258046,"nv":202928,"ns":23205,"participacion_pct":55.97842828445856},{"AELEC":2024,"EDOCVE":19,"MPIOCVE":7,"publicacion":"available","ln":12641,"sv":9903,"nv":2218,"ns":520,"participacion_pct":81.701179770646},{"AELEC":2024,"EDOCVE":19,"MPIOCVE":8,"publicacion":"available","ln":3530,"sv":1726,"nv":393,"ns":1411,"participacion_pct":81.45351580934403},{"AELEC":2024,"EDOCVE":19,"MPIOCVE":9,"publicacion":"available","ln":93702,"sv":41704,"nv":46147,"ns":5851,"participacion_pct":47.47128661028332},{"AELEC":2024,"EDOCVE":19,"MPIOCVE":10,"publicacion":"available","ln":48786,"sv":18236,"nv":26926,"ns":3624,"participacion_pct":40.3790797573181},{"AELEC":2024,"EDOCVE":19,"MPIOCVE":11,"publicacion":"available","ln":7562,"sv":4383,"nv":3179,"ns":0,"participacion_pct":57.96085691615975},{"AELEC":2024,"EDOCVE":19,"MPIOCVE":12,"publicacion":"available","ln":50126,"sv":21828,"nv":26402,"ns":1896,"participacion_pct":45.25813808832677},{"AELEC":2024,"EDOCVE":19,"MPIOCVE":13,"publicacion":"available","ln":10567,"sv":7200,"nv":3367,"ns":0,"participacion_pct":68.13665184063595},{"AELEC":2024,"EDOCVE":19,"MPIOCVE":14,"publicacion":"available","ln":30230,"sv":21040,"nv":7293,"ns":1897,"participacion_pct":74.25969717290792},{"AELEC":2024,"EDOCVE":19,"MPIOCVE":15,"publicacion":"available","ln":2900,"sv":1256,"nv":687,"ns":957,"participacion_pct":64.64230571281523},{"AELEC":2024,"EDOCVE":19,"MPIOCVE":16,"publicacion":"available","ln":3331,"sv":1666,"nv":713,"ns":952,"participacion_pct":70.02942412778478},{"AELEC":2024,"EDOCVE":19,"MPIOCVE":17,"publicacion":"available","ln":30786,"sv":16627,"nv":8835,"ns":5324,"participacion_pct":65.30123321027413},{"AELEC":2024,"EDOCVE":19,"MPIOCVE":18,"publicacion":"available","ln":247932,"sv":103185,"nv":113497,"ns":31250,"participacion_pct":47.62047608938445},{"AELEC":2024,"EDOCVE":19,"MPIOCVE":19,"publicacion":"available","ln":112768,"sv":75215,"nv":31760,"ns":5793,"participacion_pct":70.31082028511335},{"AELEC":2024,"EDOCVE":19,"MPIOCVE":20,"publicacion":"available","ln":6497,"sv":3549,"nv":1977,"ns":971,"participacion_pct":64.22366992399566},{"AELEC":2024,"EDOCVE":19,"MPIOCVE":21,"publicacion":"available","ln":345350,"sv":157847,"nv":168998,"ns":18505,"participacion_pct":48.294145542994386},{"AELEC":2024,"EDOCVE":19,"MPIOCVE":22,"publicacion":"available","ln":13935,"sv":6376,"nv":4687,"ns":2872,"participacion_pct":57.633553285727196},{"AELEC":2024,"EDOCVE":19,"MPIOCVE":23,"publicacion":"available","ln":2134,"sv":1258,"nv":714,"ns":162,"participacion_pct":63.793103448275865},{"AELEC":2024,"EDOCVE":19,"MPIOCVE":24,"publicacion":"available","ln":5558,"sv":3872,"nv":1009,"ns":677,"participacion_pct":79.3280065560336},{"AELEC":2024,"EDOCVE":19,"MPIOCVE":25,"publicacion":"available","ln":58333,"sv":26091,"nv":29705,"ns":2537,"participacion_pct":46.7614165890028},{"AELEC":2024,"EDOCVE":19,"MPIOCVE":26,"publicacion":"available","ln":553204,"sv":291932,"nv":218108,"ns":43164,"participacion_pct":57.23707944474943},{"AELEC":2024,"EDOCVE":19,"MPIOCVE":27,"publicacion":"available","ln":3073,"sv":2145,"nv":928,"ns":0,"participacion_pct":69.8014969085584},{"AELEC":2024,"EDOCVE":19,"MPIOCVE":28,"publicacion":"available","ln":13313,"sv":7605,"nv":3912,"ns":1796,"participacion_pct":66.03282104714769},{"AELEC":2024,"EDOCVE":19,"MPIOCVE":29,"publicacion":"available","ln":1541,"sv":0,"nv":0,"ns":1541,"participacion_pct":null},{"AELEC":2024,"EDOCVE":19,"MPIOCVE":30,"publicacion":"available","ln":6568,"sv":4426,"nv":2142,"ns":0,"participacion_pct":67.38733252131547},{"AELEC":2024,"EDOCVE":19,"MPIOCVE":31,"publicacion":"available","ln":3299,"sv":1990,"nv":402,"ns":907,"participacion_pct":83.19397993311037},{"AELEC":2024,"EDOCVE":19,"MPIOCVE":32,"publicacion":"available","ln":302939,"sv":127013,"nv":145274,"ns":30652,"participacion_pct":46.64673671530407},{"AELEC":2024,"EDOCVE":19,"MPIOCVE":33,"publicacion":"available","ln":5240,"sv":2878,"nv":1287,"ns":1075,"participacion_pct":69.09963985594237},{"AELEC":2024,"EDOCVE":19,"MPIOCVE":34,"publicacion":"available","ln":68791,"sv":28278,"nv":32009,"ns":8504,"participacion_pct":46.9056347139516},{"AELEC":2024,"EDOCVE":19,"MPIOCVE":35,"publicacion":"available","ln":5319,"sv":3620,"nv":1699,"ns":0,"participacion_pct":68.05790562135739},{"AELEC":2024,"EDOCVE":19,"MPIOCVE":36,"publicacion":"available","ln":2088,"sv":1078,"nv":492,"ns":518,"participacion_pct":68.6624203821656},{"AELEC":2024,"EDOCVE":19,"MPIOCVE":37,"publicacion":"available","ln":6927,"sv":4935,"nv":1992,"ns":0,"participacion_pct":71.24296232135123},{"AELEC":2024,"EDOCVE":19,"MPIOCVE":38,"publicacion":"available","ln":5093,"sv":3577,"nv":1516,"ns":0,"participacion_pct":70.23365403494994},{"AELEC":2024,"EDOCVE":19,"MPIOCVE":39,"publicacion":"available","ln":57738,"sv":26239,"nv":30471,"ns":1028,"participacion_pct":46.26873567272086},{"AELEC":2024,"EDOCVE":19,"MPIOCVE":40,"publicacion":"available","ln":963330,"sv":535348,"nv":354962,"ns":73020,"participacion_pct":60.13051633700621},{"AELEC":2024,"EDOCVE":19,"MPIOCVE":41,"publicacion":"available","ln":2195,"sv":1778,"nv":417,"ns":0,"participacion_pct":81.00227790432803},{"AELEC":2024,"EDOCVE":19,"MPIOCVE":42,"publicacion":"available","ln":91888,"sv":34851,"nv":49448,"ns":7589,"participacion_pct":41.342127427371615},{"AELEC":2024,"EDOCVE":19,"MPIOCVE":43,"publicacion":"available","ln":5936,"sv":3241,"nv":2695,"ns":0,"participacion_pct":54.59905660377358},{"AELEC":2024,"EDOCVE":19,"MPIOCVE":44,"publicacion":"available","ln":3040,"sv":1985,"nv":446,"ns":609,"participacion_pct":81.65364047716989},{"AELEC":2024,"EDOCVE":19,"MPIOCVE":45,"publicacion":"available","ln":30771,"sv":18679,"nv":11711,"ns":381,"participacion_pct":61.4642974662718},{"AELEC":2024,"EDOCVE":19,"MPIOCVE":46,"publicacion":"available","ln":60909,"sv":25382,"nv":32857,"ns":2670,"participacion_pct":43.58247909476468},{"AELEC":2024,"EDOCVE":19,"MPIOCVE":47,"publicacion":"available","ln":360366,"sv":208677,"nv":119849,"ns":31840,"participacion_pct":63.51917352051284},{"AELEC":2024,"EDOCVE":19,"MPIOCVE":48,"publicacion":"available","ln":235975,"sv":128271,"nv":99460,"ns":8244,"participacion_pct":56.32566492923669},{"AELEC":2024,"EDOCVE":19,"MPIOCVE":49,"publicacion":"available","ln":44320,"sv":25190,"nv":16788,"ns":2342,"participacion_pct":60.00762304064033},{"AELEC":2024,"EDOCVE":19,"MPIOCVE":50,"publicacion":"available","ln":2445,"sv":945,"nv":365,"ns":1135,"participacion_pct":72.13740458015268},{"AELEC":2024,"EDOCVE":19,"MPIOCVE":51,"publicacion":"available","ln":3841,"sv":2910,"nv":931,"ns":0,"participacion_pct":75.7615204373861}]}